{
  "schemaVersion": "1.0",
  "kind": "localization",
  "campaignId": "operation-lighthouse",
  "campaignVersion": "1.0.0",
  "locale": "pt-BR",
  "messages": {
    "assets.opening.purpose": "Apresentar Port Azure, a tempestade que se aproxima e a missão coletiva de recuperação.",
    "assets.opening.script": "Port Azure enfrenta tempestades há gerações, mas, nesta noite, todos os distritos encaram o mesmo horizonte. A chuva está aumentando. As rotas de transporte estão ficando limitadas. Os serviços essenciais estão sob pressão. Em toda a cidade, equipes de resposta e moradores se preparam juntos. Sua unidade está entrando no Mission Control para transformar relatos incertos em decisões fundamentadas, conectar o trabalho de especialistas e restaurar serviços essenciais com segurança. As evidências vão mudar. As ferramentas podem falhar. Os recursos são finitos. Coordenem-se com clareza, verifiquem antes de agir e mantenham as pessoas no centro de cada decisão. A tempestade está chegando. O farol ainda está aceso. Sua missão começa agora.",
    "assets.opening.pronunciation": "Port Azure: port AZH-er. Maya Chen: MAI-a tchen. Jules Martin: jul mar-TÃ.",
    "assets.opening.accessibility": "Fornecer legendas sincronizadas, narração clara sobre ambiência discreta e descrições visuais significativas na transcrição.",
    "assets.variants.presentation": "Variante principal para apresentação widescreen.",
    "assets.variants.reducedMotion": "Variante com movimento reduzido usando enquadramentos estáveis e transições suaves.",
    "assets.accessibility.noCriticalText": "Não colocar informações essenciais em textos gerados na imagem.",
    "assets.accessibility.reducedMotion": "Evitar flashes, cortes rápidos e movimentos de câmera desorientadores.",
    "assets.licensing.usageRights": "Uso e adaptação aprovados para eventos e documentação do Operation Lighthouse.",
    "assets.licensing.restrictions": "Não sugerir endosso de organizações reais nem retratar pessoas reais identificáveis.",
    "assets.commander.purpose": "Identificar Mission Commander como a liderança serena que orienta a campanha.",
    "assets.maya.purpose": "Identificar Maya Chen como a líder analítica de operações nos briefings.",
    "assets.jules.purpose": "Identificar Jules Martin como o coordenador de campo orientado por evidências.",
    "assets.characters.accessibility": "Preservar expressões faciais claras, boa separação entre pessoa e fundo e texto alternativo útil.",
    "assets.variants.dashboardAvatar": "Recorte quadrado aproximado para identidade no dashboard.",
    "assets.variants.presentationPortrait": "Retrato widescreen com espaço livre para texto da apresentação.",
    "assets.cityMap.purpose": "Fornecer a base geográfica estável para as visualizações operacionais de Port Azure.",
    "assets.cityDistricts.purpose": "Fornecer camadas alinhadas de distritos, clima, serviços e status operacional.",
    "assets.maps.accessibility": "Usar silhuetas claras, limites de alto contraste e geometria compreensível sem rótulos.",
    "assets.maps.nonColorStatus": "Combinar cada cor de status com uma forma, padrão ou estilo de linha distinto.",
    "assets.variants.mapDashboardLight": "Mapa-base neutro otimizado para o tema claro do dashboard.",
    "assets.variants.mapDashboardDark": "Mapa-base neutro otimizado para o tema escuro do dashboard.",
    "assets.variants.mapPresentation": "Mapa widescreen em alta resolução para apresentação pública.",
    "assets.variants.districtBoundaries": "Camada transparente de limites dos distritos.",
    "assets.variants.weatherLayer": "Camada transparente de clima e riscos.",
    "assets.variants.serviceLayer": "Camada transparente de serviços urbanos e abrigos.",
    "assets.variants.statusSymbols": "Símbolos transparentes de status operacional que não dependem apenas de cor."
  }
}
