{
  "schemaVersion": "1.0",
  "kind": "localization",
  "campaignId": "operation-lighthouse",
  "campaignVersion": "1.0.0",
  "locale": "en",
  "messages": {
    "assets.opening.purpose": "Introduce Port Azure, the approaching storm, and the shared recovery mission.",
    "assets.opening.script": "Port Azure has weathered generations of storms, but tonight every district faces the same horizon. Rain is strengthening. Transport routes are narrowing. Critical services are under pressure. Across the city, responders and residents are preparing together. Your unit is joining Mission Control to turn uncertain reports into grounded decisions, connect specialist work, and restore essential services safely. Evidence will change. Tools may fail. Resources are finite. Coordinate clearly, verify before acting, and keep people at the center of every decision. The storm is approaching. The lighthouse is still shining. Your mission begins now.",
    "assets.opening.pronunciation": "Port Azure: port AZH-er. Maya Chen: MY-uh chen. Jules Martin: zhool mar-TAN.",
    "assets.opening.accessibility": "Provide synchronized captions, clear narration over restrained ambience, and meaningful visual descriptions in the transcript.",
    "assets.variants.presentation": "Primary widescreen presentation variant.",
    "assets.variants.reducedMotion": "Reduced-motion variant using stable framing and dissolves.",
    "assets.accessibility.noCriticalText": "Do not place critical information in generated on-screen text.",
    "assets.accessibility.reducedMotion": "Avoid flashes, rapid cuts, and disorienting camera movement.",
    "assets.licensing.usageRights": "Approved for use and adaptation in Operation Lighthouse event delivery and documentation.",
    "assets.licensing.restrictions": "Do not imply endorsement by real organizations or depict identifiable real people.",
    "assets.commander.purpose": "Identify the Mission Commander as the calm authority guiding the campaign.",
    "assets.maya.purpose": "Identify Maya Chen as the analytical Operations Lead for mission briefings.",
    "assets.jules.purpose": "Identify Jules Martin as the evidence-minded Field Coordinator.",
    "assets.characters.accessibility": "Preserve clear facial expressions, strong subject-background separation, and useful alternative text.",
    "assets.variants.dashboardAvatar": "Square close crop for dashboard identity.",
    "assets.variants.presentationPortrait": "Widescreen portrait with negative space for presentation copy.",
    "assets.cityMap.purpose": "Provide the stable geographic foundation for Port Azure operational views.",
    "assets.cityDistricts.purpose": "Provide aligned district, weather, service, and operational status overlays.",
    "assets.maps.accessibility": "Use clear silhouettes, high-contrast boundaries, and geometry that remains understandable without labels.",
    "assets.maps.nonColorStatus": "Pair every status color with a distinct shape, pattern, or line treatment.",
    "assets.variants.mapDashboardLight": "Neutral base map optimized for the light dashboard theme.",
    "assets.variants.mapDashboardDark": "Neutral base map optimized for the dark dashboard theme.",
    "assets.variants.mapPresentation": "High-resolution widescreen map for public presentation.",
    "assets.variants.districtBoundaries": "Transparent district boundary overlay.",
    "assets.variants.weatherLayer": "Transparent weather and hazard overlay.",
    "assets.variants.serviceLayer": "Transparent city service and shelter symbol overlay.",
    "assets.variants.statusSymbols": "Transparent non-color-dependent operational status symbols."
  }
}
