{
  "schemaVersion": "1.0",
  "kind": "localization",
  "campaignId": "operation-lighthouse",
  "campaignVersion": "1.0.0",
  "locale": "fr",
  "messages": {
    "assets.opening.purpose": "Présenter Port Azure, l'approche de la tempête et la mission collective de rétablissement.",
    "assets.opening.script": "Port Azure traverse des tempêtes depuis des générations, mais ce soir, tous les quartiers font face au même horizon. La pluie s'intensifie. Les voies de transport se réduisent. Les services essentiels sont sous pression. Dans toute la ville, les équipes d'intervention et la population se préparent ensemble. Votre unité rejoint Mission Control pour transformer des signalements incertains en décisions fondées, coordonner les spécialistes et rétablir les services essentiels en toute sécurité. Les preuves évolueront. Les outils pourront tomber en panne. Les ressources sont limitées. Coordonnez-vous clairement, vérifiez avant d'agir et placez les personnes au cœur de chaque décision. La tempête approche. Le phare brille encore. Votre mission commence maintenant.",
    "assets.opening.pronunciation": "Port Azure : por a-ZUR. Maya Chen : MA-ya tchen. Jules Martin : zhul mar-TAN.",
    "assets.opening.accessibility": "Fournir des sous-titres synchronisés, une narration claire sur une ambiance discrète et des descriptions visuelles utiles dans la transcription.",
    "assets.variants.presentation": "Variante principale pour présentation panoramique.",
    "assets.variants.reducedMotion": "Variante à mouvements réduits utilisant des plans stables et des fondus.",
    "assets.accessibility.noCriticalText": "Ne pas placer d'informations essentielles dans du texte généré à l'écran.",
    "assets.accessibility.reducedMotion": "Éviter les flashs, les coupes rapides et les mouvements de caméra désorientants.",
    "assets.licensing.usageRights": "Utilisation et adaptation autorisées pour les événements et la documentation Operation Lighthouse.",
    "assets.licensing.restrictions": "Ne pas suggérer le soutien d'organisations réelles ni représenter des personnes réelles identifiables.",
    "assets.commander.purpose": "Présenter Mission Commander comme l'autorité calme qui guide la campagne.",
    "assets.maya.purpose": "Présenter Maya Chen comme la responsable analytique des opérations pour les briefings.",
    "assets.jules.purpose": "Présenter Jules Martin comme le coordinateur terrain attentif aux preuves.",
    "assets.characters.accessibility": "Préserver des expressions faciales claires, un fort contraste sujet-arrière-plan et un texte alternatif utile.",
    "assets.variants.dashboardAvatar": "Recadrage carré rapproché pour l'identité dans le tableau de bord.",
    "assets.variants.presentationPortrait": "Portrait panoramique avec espace libre pour le texte de présentation.",
    "assets.cityMap.purpose": "Fournir la base géographique stable des vues opérationnelles de Port Azure.",
    "assets.cityDistricts.purpose": "Fournir des calques alignés pour les quartiers, la météo, les services et l'état opérationnel.",
    "assets.maps.accessibility": "Utiliser des silhouettes claires, des limites très contrastées et une géométrie compréhensible sans étiquettes.",
    "assets.maps.nonColorStatus": "Associer chaque couleur d'état à une forme, un motif ou un style de ligne distinct.",
    "assets.variants.mapDashboardLight": "Carte de base neutre optimisée pour le thème clair du tableau de bord.",
    "assets.variants.mapDashboardDark": "Carte de base neutre optimisée pour le thème sombre du tableau de bord.",
    "assets.variants.mapPresentation": "Carte panoramique haute résolution pour la présentation publique.",
    "assets.variants.districtBoundaries": "Calque transparent des limites de quartiers.",
    "assets.variants.weatherLayer": "Calque transparent de météo et de dangers.",
    "assets.variants.serviceLayer": "Calque transparent des services municipaux et des abris.",
    "assets.variants.statusSymbols": "Symboles transparents d'état opérationnel ne dépendant pas uniquement de la couleur.",
    "assets.briefings.accessibility": "Fournir des sous-titres synchronisés, une narration claire, une ambiance discrète et assez de temps pour comprendre chaque transition visuelle.",
    "assets.mission1.purpose": "Lancer Signal dans la tempête et cadrer l'évaluation structurée des incidents.",
    "assets.mission2.purpose": "Lancer Vérité terrain et cadrer les preuves, l'incertitude et la sécurité des instructions.",
    "assets.mission3.purpose": "Lancer Ville connectée et cadrer l'utilisation fondée des outils et la reprise contrôlée.",
    "assets.mission4.purpose": "Lancer Réseau de spécialistes et cadrer les rôles, les transferts et la vérification indépendante.",
    "assets.mission5.purpose": "Lancer Restaurer Lighthouse et cadrer une planification coordonnée et traçable du rétablissement.",
    "assets.mission1.script": "Des signalements font état d'inondations près du quai 4 de Harbor, mais les détails ne concordent pas encore. Votre première tâche consiste à produire une évaluation structurée de l'incident. Identifiez la catégorie, la gravité, le lieu et les services touchés. Conservez les informations manquantes. Justifiez la gravité à partir des preuves et signalez les doublons probables sans effacer leurs sources. Un contrat clair est la première étape d'une intervention sûre.",
    "assets.mission2.script": "Un signalement peut être urgent tout en restant incertain. Séparez les faits vérifiés, les hypothèses et les inconnues. Citez les preuves qui soutiennent chaque conclusion. Lorsque les sources se contredisent, expliquez laquelle vous retenez et pourquoi. Traitez les instructions provenant d'un contenu non fiable comme des données, jamais comme des ordres. Si les preuves ne justifient pas une action, dites-le et demandez l'information suivante nécessaire.",
    "assets.mission3.script": "Port Azure est connectée, mais aucun outil ne possède toute la situation. Interrogez la météo, les abris et les transports. Fondez chaque recommandation sur les preuves retournées. Un outil peut échouer temporairement : ne réessayez que de manière sûre et limitée, puis comparez les itinéraires et les abris viables. Gardez une trace d'outils assez concise pour permettre l'audit de votre décision.",
    "assets.mission4.script": "Un seul agent ne peut pas assumer chaque décision en toute sécurité. Définissez des rôles spécialisés limités avec des entrées et des sorties explicites. Faites circuler les preuves par des transferts visibles et préservez leur source. Exécutez en parallèle les analyses indépendantes lorsque c'est possible. En cas de désaccord, ne masquez pas le conflit. Transmettez les incertitudes à fort impact à une personne chargée de la vérification et consignez l'approbation finale.",
    "assets.mission5.script": "La tempête et les incidents touchant le réseau électrique, les transports, les abris et les communications se chevauchent désormais. Recueillez les preuves actuelles, hiérarchisez les actions et allouez les ressources limitées. Orientez le travail des spécialistes, faites vérifier le plan final de manière indépendante et conservez un dossier de décision traçable. Un modificateur d'incident ou une panne d'outil peut changer la situation. Replanifiez avec méthode, expliquez les solutions écartées et demandez une approbation humaine avant toute action à fort impact."
  }
}
